{
  "schema_version": "1.0.0",
  "export_package_id": "run_export_summary_11111111aaaa",
  "run_id": "run_set_11111111aaaa",
  "transfer_id": "audit_transfer_11111111aaaa",
  "request_digest": "aaaaaaaaaaaaaaaaaaaaaaaaaaaaaaaaaaaaaaaaaaaaaaaaaaaaaaaaaaaaaaaa",
  "bundle_root": "harness/audit/runs/run_set_11111111aaaa",
  "source_run_index_path": "harness/audit/slice_11_run_export_index.json",
  "source_transfer_bundle_path": "harness/audit/slice_10_audit_transfer_audit_transfer_11111111aaaa.zip",
  "source_transfer_manifest_path": "harness/audit/slice_10_audit_transfer_manifest_audit_transfer_11111111aaaa.json",
  "summary_path": "harness/audit/runs/run_set_11111111aaaa/slice_12_audit_summary_run_export_summary_11111111aaaa.md",
  "registry_record_path": "harness/audit/runs/run_set_11111111aaaa/slice_12_export_registry_record_run_export_summary_11111111aaaa.json",
  "summary_manifest_path": "harness/audit/runs/run_set_11111111aaaa/slice_12_run_export_summary_package_manifest_run_export_summary_11111111aaaa.json",
  "summary_package_path": "harness/audit/runs/run_set_11111111aaaa/slice_12_run_export_summary_package_run_export_summary_11111111aaaa.zip",
  "receipt_ids": [
    "rcpt_11111111aaaa",
    "rcpt_22222222bbbb"
  ],
  "artifact_count": 4,
  "included_artifacts": [
    {
      "artifact_kind": "audit_transfer_bundle",
      "relative_path": "transfer/run_audit_transfer_bundle.zip",
      "sha256": "bbbbbbbbbbbbbbbbbbbbbbbbbbbbbbbbbbbbbbbbbbbbbbbbbbbbbbbbbbbbbbbb"
    },
    {
      "artifact_kind": "audit_transfer_manifest",
      "relative_path": "transfer/audit_transfer_manifest.json",
      "sha256": "cccccccccccccccccccccccccccccccccccccccccccccccccccccccccccccccc"
    },
    {
      "artifact_kind": "audit_summary",
      "relative_path": "summary/audit_summary.md",
      "sha256": "dddddddddddddddddddddddddddddddddddddddddddddddddddddddddddddddd"
    },
    {
      "artifact_kind": "registry_record",
      "relative_path": "registry/export_registry_record.json",
      "sha256": "eeeeeeeeeeeeeeeeeeeeeeeeeeeeeeeeeeeeeeeeeeeeeeeeeeeeeeeeeeeeeeee"
    }
  ]
}
