{
  "artifact_count": 4,
  "bundle_root": "harness/audit/runs/run_set_4f8dd89349cfb07b",
  "export_package_id": "run_export_summary_8e11af1223d05125",
  "included_artifacts": [
    {
      "artifact_kind": "audit_transfer_bundle",
      "relative_path": "transfer/run_audit_transfer_bundle.zip",
      "sha256": "52c3ff1a71aeb62372ab0fe0c0fa01b71d9b6ea13b919385982b2b4e27ecc19d"
    },
    {
      "artifact_kind": "audit_transfer_manifest",
      "relative_path": "transfer/audit_transfer_manifest.json",
      "sha256": "a2245c61ba45e69f0ce583ab46b53c1593227986e4f52a778cf0050960375143"
    },
    {
      "artifact_kind": "audit_summary",
      "relative_path": "summary/audit_summary.md",
      "sha256": "6ff25604ba436565becf58e517e770c8fec8afb82d51514c1261f6915cd3debd"
    },
    {
      "artifact_kind": "registry_record",
      "relative_path": "registry/export_registry_record.json",
      "sha256": "f5da7ddb9aa0836e73f3767d55af9d49f6dcde2443411923b5c601e291fc9307"
    }
  ],
  "receipt_ids": [
    "rcpt_0990c0414b9fec53",
    "rcpt_1ae7ddadb1e68689",
    "rcpt_83c93bd52dc41068",
    "rcpt_c9d30156e36fd002"
  ],
  "registry_record_path": "harness/audit/runs/run_set_4f8dd89349cfb07b/slice_12_export_registry_record_run_export_summary_8e11af1223d05125.json",
  "request_digest": "2770039d0acfea0cd880d36b6542373863d599531a6e13706cb833f9dba4ea1e",
  "run_id": "run_set_4f8dd89349cfb07b",
  "schema_version": "1.0.0",
  "source_run_index_path": "harness/audit/slice_11_run_export_index.json",
  "source_transfer_bundle_path": "harness/audit/slice_10_audit_transfer_audit_transfer_f53923a4992f26db.zip",
  "source_transfer_manifest_path": "harness/audit/slice_10_audit_transfer_manifest_audit_transfer_f53923a4992f26db.json",
  "summary_manifest_path": "harness/audit/runs/run_set_4f8dd89349cfb07b/slice_12_run_export_summary_package_manifest_run_export_summary_8e11af1223d05125.json",
  "summary_package_path": "harness/audit/runs/run_set_4f8dd89349cfb07b/slice_12_run_export_summary_package_run_export_summary_8e11af1223d05125.zip",
  "summary_path": "harness/audit/runs/run_set_4f8dd89349cfb07b/slice_12_audit_summary_run_export_summary_8e11af1223d05125.md",
  "transfer_id": "audit_transfer_f53923a4992f26db"
}
